,date,href,intro,title
0,"Oct 24, 2016, 10:38 AM IST",http://economictimes.indiatimes.com/markets/stocks/news/etmarkets-com-survey-d-street-votes-for-hillary-expects-her-to-lift-sensex-4/articleshow/55025126.cms,"dalal street mavens believe a win for hillary clinton could prove to be a big positive for markets across the globe, including india, the survey showed.","etmarkets.com survey: d-street votes for hillary, expects her to lift sensex 4%"
0,"Oct 24, 2016, 09:24 AM IST",http://economictimes.indiatimes.com/markets/stocks/news/whats-d-street-talking-about-before-opening-bell/articleshow/55022794.cms,"the nifty50 reclaimed its crucial resistance level of 8,700 supported by gains in power, consumer durables, capital goods, banks, auto, and oil & gas stocks.","sensex climbs 100 points, nifty reclaims 8,700; wipro tanks 3%"
0,"Oct 24, 2016, 09:24 AM IST",http://economictimes.indiatimes.com/markets/stocks/news/whats-d-street-talking-about-before-opening-bell/articleshow/55022794.cms,"the nifty50 reclaimed its crucial resistance level of 8,700 supported by gains in power, consumer durables, capital goods, banks, auto, and oil & gas stocks.","sensex climbs 100 points, nifty reclaims 8,700; wipro tanks 3%"
0,"Oct 21, 2016, 06:20 PM IST",http://economictimes.indiatimes.com/markets/stocks/news/indiabulls-housing-finance-q2-net-up-23-2-at-rs-684-cr/articleshow/54978538.cms,"growth was driven by home loan portfolio, which grew by 35
per cent in the quarter. loans grew 30 per cent to rs 75,313 crore mainly due
to home loans.",indiabulls housing finance q2 net up 23.2% at rs 684 cr
0,"Oct 24, 2016, 04:11 PM IST",http://economictimes.indiatimes.com/markets/stocks/news/sensex-gains-102-points-nifty-tops-8700-ongc-rallies-4/articleshow/55030294.cms,"throughout the day, shares swung between gains and losses with eyes firmly set on september quarter earnings of biggies such as hdfc bank, axis bank and idea cellular.","sensex gains 102 points; nifty tops 8,700; ongc rallies 4%"
0,"Oct 24, 2016, 04:11 PM IST",http://economictimes.indiatimes.com/markets/stocks/news/sensex-gains-102-points-nifty-tops-8700-ongc-rallies-4/articleshow/55030294.cms,"throughout the day, shares swung between gains and losses with eyes firmly set on september quarter earnings of biggies such as hdfc bank, axis bank and idea cellular.","sensex gains 102 points; nifty tops 8,700; ongc rallies 4%"
0,"Oct 24, 2016, 03:23 PM IST",http://economictimes.indiatimes.com/markets/stocks/news/mcx-acquires-office-space-in-guajrats-gift-city/articleshow/55029435.cms,this office space will be utilised by mcx to set-up a full-fledged business continuity facility with state-of-the-art disaster recovery infrastructure.,mcx acquires office space in guajrat's gift city
0,"Oct 24, 2016, 01:55 PM IST",http://economictimes.indiatimes.com/markets/stocks/news/hong-kong-stocks-follow-china-market-higher-amid-yuan-depreciation-concern/articleshow/55028228.cms,"the hang seng index rose 1.0 per cent, to 23,604.08, while the china enterprises index gained 1.7 per cent, to 9,852.90 points.",hong kong stocks follow china market higher amid yuan depreciation concern
0,"Oct 25, 2016, 08:15 AM IST",http://economictimes.indiatimes.com/markets/stocks/news/cyrus-mistrys-ouster-likely-to-hit-tata-stocks/articleshow/55042301.cms,"fund managers said mistry's exit creates an impression that the group's insiders were unhappy with such measures, which were given thumbs up by the market.",cyrus mistry's ouster likely to hit tata stocks
0,"Oct 25, 2016, 08:13 AM IST",http://economictimes.indiatimes.com/markets/stocks/news/fifteen-stocks-in-focus-on-tuesday-october-25-2016/articleshow/55042269.cms,the indian market is expected to open higher. here is a list of top fifteen stocks that are likely to be in focus today.,"fifteen stocks in focus on tuesday, october 25, 2016"
0,"Oct 25, 2016, 08:08 AM IST",http://economictimes.indiatimes.com/markets/stocks/news/this-is-not-a-crisis-situation-at-tatas-raamdeo-agarwal-joint-md-motilal-oswal-financial-services/articleshow/55042182.cms,stock returns of tata group would have been the same regardless of who chairman is. market is concerned more about fundamentals than chairman change.,"this is not a crisis situation at tatas: raamdeo agarwal, joint md, motilal oswal financial services"
0,"Oct 25, 2016, 08:08 AM IST",http://economictimes.indiatimes.com/markets/stocks/news/this-is-not-a-crisis-situation-at-tatas-raamdeo-agarwal-joint-md-motilal-oswal-financial-services/articleshow/55042182.cms,stock returns of tata group would have been the same regardless of who chairman is. market is concerned more about fundamentals than chairman change.,"this is not a crisis situation at tatas: raamdeo agarwal, joint md, motilal oswal financial services"
0,"Oct 25, 2016, 08:05 AM IST",http://economictimes.indiatimes.com/markets/stocks/news/tata-group-stocks-fail-to-enchant-retail-investors-heres-how/articleshow/55042151.cms,retail investors have increased their stake in most stocks except five during ratan tata's last 4 years. not all the tata group stocks have given a good return.,tata group stocks fail to enchant retail investors. here's how
0,"Oct 25, 2016, 08:05 AM IST",http://economictimes.indiatimes.com/markets/stocks/news/tata-group-stocks-fail-to-enchant-retail-investors-heres-how/articleshow/55042151.cms,retail investors have increased their stake in most stocks except five during ratan tata's last 4 years. not all the tata group stocks have given a good return.,tata group stocks fail to enchant retail investors. here's how
0,"Oct 25, 2016, 07:57 AM IST",http://economictimes.indiatimes.com/markets/stocks/news/tata-group-investors-gained-in-mistrys-reign-but-9-most-indebted-firms-saw-debt-climb/articleshow/55042029.cms,"since 2013, the total market capitalisation of the tata group companies outperformed the market by 2%. it increased to 15.1% annually in the past three years.","tata group investors gained in mistrys reign, but 9 most indebted firms saw debt climb"
0,"Oct 25, 2016, 07:57 AM IST",http://economictimes.indiatimes.com/markets/stocks/news/tata-group-investors-gained-in-mistrys-reign-but-9-most-indebted-firms-saw-debt-climb/articleshow/55042029.cms,"since 2013, the total market capitalisation of the tata group companies outperformed the market by 2%. it increased to 15.1% annually in the past three years.","tata group investors gained in mistrys reign, but 9 most indebted firms saw debt climb"
0,"Oct 25, 2016, 07:57 AM IST",http://economictimes.indiatimes.com/markets/stocks/news/tata-group-investors-gained-in-mistrys-reign-but-9-most-indebted-firms-saw-debt-climb/articleshow/55042029.cms,"since 2013, the total market capitalisation of the tata group companies outperformed the market by 2%. it increased to 15.1% annually in the past three years.","tata group investors gained in mistrys reign, but 9 most indebted firms saw debt climb"
0,"Oct 25, 2016, 10:37 AM IST",http://economictimes.indiatimes.com/markets/stocks/news/samajwadi-party-internal-strife-raises-hope-of-bjp-win-in-up-betters-market-prospect/articleshow/55044693.cms,global investment bank clsa said the recent events have given enough leverage to the ruling bjp to make headway in the forthcoming assembly elections.,"samajwadi party internal strife raises hope of bjp win in up, betters market prospect"
0,"Oct 25, 2016, 10:04 AM IST",http://economictimes.indiatimes.com/markets/stocks/news/tata-group-stocks-take-a-hit-on-mistry-ous-exit/articleshow/55043843.cms,"the announcement came in as a shock for investors as mistry, who was the group chairman since december 2012, was seen consolidating the businesses.",tata group stocks take a hit on mistry-ous exit
0,"Oct 25, 2016, 10:04 AM IST",http://economictimes.indiatimes.com/markets/stocks/news/tata-group-stocks-take-a-hit-on-mistry-ous-exit/articleshow/55043843.cms,"the announcement came in as a shock for investors as mistry, who was the group chairman since december 2012, was seen consolidating the businesses.",tata group stocks take a hit on mistry-ous exit
0,"Oct 25, 2016, 10:04 AM IST",http://economictimes.indiatimes.com/markets/stocks/news/tata-group-stocks-take-a-hit-on-mistry-ous-exit/articleshow/55043843.cms,"the announcement came in as a shock for investors as mistry, who was the group chairman since december 2012, was seen consolidating the businesses.",tata group stocks take a hit on mistry-ous exit
0,"Oct 26, 2016, 09:27 AM IST",http://economictimes.indiatimes.com/markets/stocks/news/market-cues-buzzing-at-breakfast-tables-this-morning/articleshow/55061488.cms,"the nifty50 slipped below its crucial support level of 8,650 weighed down by losses in realty, power, oil & gas, metal, consumer durable, and banking stocks.","sensex slips below 28k, down over 200 points; nifty50 under 8,650 level"
0,"Oct 26, 2016, 09:16 AM IST",http://economictimes.indiatimes.com/markets/stocks/news/siri-catch-market-cheats-wall-street-watchdogs-turn-to-artificial-intelligence/articleshow/55062689.cms,"artificial intelligence is the notion that computers can imitate nuanceding language, solving puzzles or even diagnosing diseases.","'siri, catch market cheats': wall street watchdogs turn to artificial intelligence"
0,"Oct 26, 2016, 08:26 AM IST",http://economictimes.indiatimes.com/markets/stocks/news/fifteen-stocks-in-focus-on-wednesday-october-26-2016/articleshow/55061861.cms,the indian market is expected to open lower on wednesday. here is a list of top fifteen stocks that are likely to be in focus today.,"fifteen stocks in focus on wednesday, october 26, 2016"
0,"Oct 26, 2016, 11:38 AM IST",http://economictimes.indiatimes.com/markets/stocks/news/top-ten-intraday-trading-ideas-for-afternoon-trade-for-wednesday-26-october-2016/articleshow/55064699.cms,etmarkets.com collated list of trading ideas from various experts and here's what they had recommended.,"top ten intraday trading ideas for afternoon trade for wednesday, 26 october 2016"
0,"Oct 26, 2016, 11:29 AM IST",http://economictimes.indiatimes.com/markets/stocks/news/clsa-bullish-on-hdfc-bank-kotak-mahindra-bank-and-airtel-post-q2-result/articleshow/55064561.cms,"it has a buy rating and a target price of rs 1,530 on hdfc
bank, target price of rs 890 for kotak mahindra bank and target price of rs 410
for bharti airtel.","clsa bullish on hdfc bank, kotak mahindra bank and airtel post q2 result"
0,"Oct 26, 2016, 11:29 AM IST",http://economictimes.indiatimes.com/markets/stocks/news/clsa-bullish-on-hdfc-bank-kotak-mahindra-bank-and-airtel-post-q2-result/articleshow/55064561.cms,"it has a buy rating and a target price of rs 1,530 on hdfc
bank, target price of rs 890 for kotak mahindra bank and target price of rs 410
for bharti airtel.","clsa bullish on hdfc bank, kotak mahindra bank and airtel post q2 result"
0,"Oct 26, 2016, 11:29 AM IST",http://economictimes.indiatimes.com/markets/stocks/news/clsa-bullish-on-hdfc-bank-kotak-mahindra-bank-and-airtel-post-q2-result/articleshow/55064561.cms,"it has a buy rating and a target price of rs 1,530 on hdfc
bank, target price of rs 890 for kotak mahindra bank and target price of rs 410
for bharti airtel.","clsa bullish on hdfc bank, kotak mahindra bank and airtel post q2 result"
0,"Oct 26, 2016, 11:29 AM IST",http://economictimes.indiatimes.com/markets/stocks/news/clsa-bullish-on-hdfc-bank-kotak-mahindra-bank-and-airtel-post-q2-result/articleshow/55064561.cms,"it has a buy rating and a target price of rs 1,530 on hdfc
bank, target price of rs 890 for kotak mahindra bank and target price of rs 410
for bharti airtel.","clsa bullish on hdfc bank, kotak mahindra bank and airtel post q2 result"
0,"Oct 27, 2016, 12:09 AM IST",http://economictimes.indiatimes.com/markets/stocks/news/sebi-to-look-into-tata-mistry-saga-for-possible-breach-of-corporate-governance-rules/articleshow/55072672.cms,"we are taking note of every development and will act immediately if there is any hint of a possible violation of corporate governance, a senior official said.",sebi to look into tata-mistry saga for possible breach of corporate governance rules
0,"Oct 26, 2016, 07:54 PM IST",http://economictimes.indiatimes.com/markets/stocks/news/bourses-seek-clarification-from-tatas-on-mistry-letter/articleshow/55072881.cms,"in an email to tata sons board members, mistry warned that the salt-to-software giant may face rs 1.18 lakh crore in writedowns because of five unprofitable businesses he inherited.",bourses seek clarification from tatas on mistry letter
0,"Oct 26, 2016, 06:37 PM IST",http://economictimes.indiatimes.com/markets/stocks/news/mistry-ouster-rs-21000-crore-wiped-out-from-tata-stocks/articleshow/55071520.cms,"shares of tata motors dipped 4.27 per cent, tata steel slumped 4.01 per cent, tata power lost 2.06 per cent and tcs fell by 0.07 per cent on bse on wednesday.","mistry ouster: rs 21,000 crore wiped out from tata stocks"
0,"Oct 26, 2016, 05:51 PM IST",http://economictimes.indiatimes.com/markets/stocks/news/mapping-the-market-icici-bank-dream-run-ends-commodity-stocks-crumble/articleshow/55070742.cms,"in this article, etmarkets.com have tried to capture all the trends that played out on dalal street on the day that might give you hints on the forthcoming sessions.",mapping the market: icici bank dream run ends; commodity stocks crumble
0,"Oct 26, 2016, 05:31 PM IST",http://economictimes.indiatimes.com/markets/stocks/news/tech-view-nifty50-forms-bearish-belt-hold-pattern-on-charts-avoid-fresh-longs/articleshow/55070384.cms,"a bearish belt hold pattern is formed when the opening price becomes the highest point of the trading day, which means there is no upper shadow.",tech view: nifty50 forms 'bearish belt hold' pattern on charts; avoid fresh longs
0,"Oct 26, 2016, 04:33 PM IST",http://economictimes.indiatimes.com/markets/stocks/news/sensex-cracks-265-points-nifty-below-8620-after-spree-of-q2-results-axis-bank-falls-8/articleshow/55069383.cms,"dalal street is yet to get over of the big shakeup at tata group, where its chairman of four years cyrus mistry was ousted abruptly by the board members.","sensex cracks 255 points, nifty below 8,620 after spree of q2 results; axis bank falls 8%"
0,"Oct 26, 2016, 04:33 PM IST",http://economictimes.indiatimes.com/markets/stocks/news/sensex-cracks-265-points-nifty-below-8620-after-spree-of-q2-results-axis-bank-falls-8/articleshow/55069383.cms,"dalal street is yet to get over of the big shakeup at tata group, where its chairman of four years cyrus mistry was ousted abruptly by the board members.","sensex cracks 255 points, nifty below 8,620 after spree of q2 results; axis bank falls 8%"
0,"Oct 26, 2016, 11:19 AM IST",http://economictimes.indiatimes.com/markets/stocks/news/axis-banks-bad-slip-on-bad-loans-may-derail-some-targets/articleshow/55064402.cms,the bank also changed its guidance on the credit cost for fy17 from 125-150 bps last quarter to about 300-305 bps due to expectations of higher slippages and provisioning.,axis bank's bad slip on bad loans may derail some targets
0,"Oct 26, 2016, 11:12 AM IST",http://economictimes.indiatimes.com/markets/stocks/news/thumbs-up-for-indiabulls-housing-finance-post-q2-show/articleshow/55064309.cms,brokerages have raised the target price for ihf by 11-26%. the shares of ihf slipped 0.52% to close at rs 867.50 on bse on tuesday.,thumbs up for indiabulls housing finance post q2 show
0,"Oct 26, 2016, 11:00 AM IST",http://economictimes.indiatimes.com/markets/stocks/news/tata-mutiny-must-yield-a-bounty-will-the-palace-intrigue-ruin-investors/articleshow/55064108.cms,"when it comes to future returns, though, ratan tata may have reasons to be anxious about the direction in which mistry was steering the ship.",tata mutiny must yield a bounty: will the palace intrigue ruin investors?
0,"Oct 26, 2016, 01:27 PM IST",http://economictimes.indiatimes.com/markets/stocks/news/ratan-tata-versus-cyrus-mistry-the-slugfest-begins-at-tata-sons/articleshow/55066518.cms,"the reasons behind the ouster will be important for investors in the group's units, who, at present, have no idea how the coup at the holding company will affect them.",ratan tata versus cyrus mistry: the slugfest begins at tata sons
0,"Oct 26, 2016, 01:27 PM IST",http://economictimes.indiatimes.com/markets/stocks/news/ratan-tata-versus-cyrus-mistry-the-slugfest-begins-at-tata-sons/articleshow/55066518.cms,"the reasons behind the ouster will be important for investors in the group's units, who, at present, have no idea how the coup at the holding company will affect them.",ratan tata versus cyrus mistry: the slugfest begins at tata sons
0,"Oct 27, 2016, 09:36 AM IST",http://economictimes.indiatimes.com/markets/stocks/news/whats-buzzing-on-breakfast-tables-before-opening-bell/articleshow/55084171.cms,"domestic equity indices are likely to trade on a flat to negative note on thursday, tracking mixed closing for us stocks in overnight trade.","sensex slips over 100 points; nifty50 below 8,600; tata group stocks crack up to 9%"
0,"Oct 27, 2016, 09:36 AM IST",http://economictimes.indiatimes.com/markets/stocks/news/whats-buzzing-on-breakfast-tables-before-opening-bell/articleshow/55084171.cms,"domestic equity indices are likely to trade on a flat to negative note on thursday, tracking mixed closing for us stocks in overnight trade.","sensex slips over 100 points; nifty50 below 8,600; tata group stocks crack up to 9%"
0,"Oct 27, 2016, 09:36 AM IST",http://economictimes.indiatimes.com/markets/stocks/news/whats-buzzing-on-breakfast-tables-before-opening-bell/articleshow/55084171.cms,"domestic equity indices are likely to trade on a flat to negative note on thursday, tracking mixed closing for us stocks in overnight trade.","sensex slips over 100 points; nifty50 below 8,600; tata group stocks crack up to 9%"
0,"Oct 27, 2016, 08:31 AM IST",http://economictimes.indiatimes.com/markets/stocks/news/fifteen-stocks-in-focus-on-thursday-27-october-2016/articleshow/55084771.cms,the indian market is expected to open lower. here is a list of top fifteen stocks that are likely to be in focus today.,"fifteen stocks in focus on thursday, 27 october 2016"
0,"Oct 27, 2016, 08:11 AM IST",http://economictimes.indiatimes.com/markets/stocks/news/expansion-lower-interest-outgo-to-power-adani-transmission/articleshow/55084515.cms,the average interest rate is likely to come down after the debt refinancing at an attractive rate by using instruments such as masala bonds and us bonds of 10-year maturity.,"expansion, lower interest outgo to power adani transmission"
0,"Oct 25, 2016, 05:28 PM IST",http://economictimes.indiatimes.com/markets/stocks/news/tech-view-hanging-man-pattern-on-nifty-charts-trade-with-caution/articleshow/55051717.cms,"a bearish belt hold pattern gets formed when the opening price becomes the highest point of the trading day, which means there is no upper shadow.",tech view: hanging man pattern on nifty charts; trade with caution
0,"Oct 25, 2016, 04:15 PM IST",http://economictimes.indiatimes.com/markets/stocks/news/sensex-sheds-87-points-nifty50-slips-below-8700-tata-steel-down-2/articleshow/55050351.cms,"the nifty50 index of the national stock exchange slipped below its crucial psychological level of 8,700 to close at 8,691, down 17.65 points.","sensex sheds 87 points, nifty50 slips below 8,700; tata steel down 2%"
0,"Oct 25, 2016, 03:35 PM IST",http://economictimes.indiatimes.com/markets/stocks/news/ecl-finance-raises-rs-502-crore-via-masala-bonds/articleshow/55049570.cms,"sun global investments, london and emirates nbd bank, dubai are the global coordinators and joint lead managers on the transaction.",ecl finance raises rs 502 crore via masala bonds
0,"Oct 25, 2016, 02:57 PM IST",http://economictimes.indiatimes.com/markets/stocks/news/cyrus-mistry-ouster-may-put-a-spanner-in-tata-steels-europe-joint-venture/articleshow/55048818.cms,it was widely believed that cyrus mistry was the driver of tata steels strategy to sell-off its european assets.,cyrus mistry ouster may put a spanner in tata steels europe joint venture
0,"Oct 25, 2016, 02:55 PM IST",http://economictimes.indiatimes.com/markets/stocks/news/ratan-tata-asks-groups-heads-to-go-about-business-as-usual/articleshow/55048767.cms,"we will evaluate and continue to undertake those that are required to. if there is any change, they will be discussed with you, said tata.",ratan tata asks group's heads to go about business as usual
0,"Oct 25, 2016, 01:31 PM IST",http://economictimes.indiatimes.com/markets/stocks/news/top-five-takeaways-from-hdfc-bank-results-for-investors/articleshow/55047487.cms,"total income from operations increased from rs 17,324 crore for the quarter ended sept 30, 2015, to rs 19,970 crore for the quarter ended sept 30, 2016.",top five takeaways from hdfc bank results for investors
0,"Oct 25, 2016, 01:31 PM IST",http://economictimes.indiatimes.com/markets/stocks/news/top-five-takeaways-from-hdfc-bank-results-for-investors/articleshow/55047487.cms,"total income from operations increased from rs 17,324 crore for the quarter ended sept 30, 2015, to rs 19,970 crore for the quarter ended sept 30, 2016.",top five takeaways from hdfc bank results for investors
0,"Oct 28, 2016, 11:05 AM IST",http://economictimes.indiatimes.com/markets/stocks/news/tech-mahindra-surges-7-after-q2-numbers/articleshow/55109092.cms,"revenues for the quarter rose 3.6 per cent yoy to rs 7,167.40 crore from rs 6,921 crore reported for the june quarter. the numbers were better than street estimates.",tech mahindra surges 7% after q2 numbers
0,"Oct 28, 2016, 09:32 AM IST",http://economictimes.indiatimes.com/markets/stocks/news/whats-d-street-talking-about-before-opening-bell/articleshow/55106172.cms,"domestic equity indices are likely to trade on a negative note on friday, tracking a rise in us stocks in overnight trade, ahead of results of many blue-chip companies.","sensex slips over 100 points; nifty50 tests 8,600 level"
0,"Oct 28, 2016, 04:52 PM IST",http://economictimes.indiatimes.com/markets/stocks/news/tech-view-nifty50-forms-hammer-like-pattern-ahead-of-muhurat-trading/articleshow/55115553.cms,"in other words, it signals a capitulation by the sellers to form a bottom accompanied by a price rise, indicating fresh buying at lower levels.",tech view: nifty50 forms hammer like pattern ahead of 'muhurat trading'
0,"Oct 31, 2016, 01:38 PM IST",http://economictimes.indiatimes.com/markets/stocks/news/nikkei-drops-on-us-election-uncertainty-but-shipping-stocks-steam-ahead/articleshow/55151957.cms,"investors are focused on a us federal reserve policy review on wednesday and us jobs data on friday, ahead of the november 8 presidential election.",nikkei drops on us election uncertainty but shipping stocks steam ahead
0,"Oct 31, 2016, 01:01 PM IST",http://economictimes.indiatimes.com/markets/stocks/news/top-five-mistakes-mark-mobius-want-investors-to-avoid-during-samvat-2073/articleshow/55150454.cms,"""the first thing that people have to realise is that investment in stocks is probably one of the best ways to save and grow money,"" says mobius.",top five mistakes mark mobius wants investors to avoid during samvat 2073
0,"Oct 31, 2016, 09:52 AM IST",http://economictimes.indiatimes.com/markets/stocks/news/nikkei-drops-as-us-election-uncertainty-sours-mood-shippers-jump/articleshow/55148996.cms,"the nikkei fell 0.5 percent to 17,353.04 by midmorning, after ending at a six-month high on friday.",nikkei drops as us election uncertainty sours mood; shippers jump
0,"Oct 30, 2016, 07:41 PM IST",http://economictimes.indiatimes.com/markets/stocks/news/sensex-rallies-over-100-points-nifty50-reclaims-8650-levels/articleshow/55142640.cms,"the sensex fell over 50 points after starting on a promising note but the 30-stock benchmark ended the one-hour session at 27,930, down 11.30 points or 0.04%.","sensex ends flat in muhurat trading; nifty50 below 8,630"
0,"Oct 30, 2016, 07:15 PM IST",http://economictimes.indiatimes.com/markets/stocks/news/gic-housing-finance-rallies-over-4-as-q2-profit-grows-to-rs-34-crore/articleshow/55143038.cms,companys net profit stood at rs 29.79 crore for the corresponding quarter of previous financial year 2015-16.,gic housing finance rallies nearly 2% as q2 net profit grows to rs 34 crore
0,"Oct 30, 2016, 04:36 PM IST",http://economictimes.indiatimes.comhttp://economictimes.indiatimes.com/sensex-gives-up-gains-ends-above-28k-nifty-tops-8600-lt-fin-gains-9-drl-tanks-10/liveblog/55141587.cms,"welcome to our special coverage of muhurat trading, a traditional practice of investors to make an auspicious start to the new samvat year, by buying stocks.","track sensex, nifty live: look who is moving my market"
0,"Oct 27, 2016, 06:37 PM IST",http://economictimes.indiatimes.com/markets/stocks/news/tata-group-stocks-come-under-a-cloudgood-earnings-key-for-any-re-rating/articleshow/55096002.cms,"if the group companies report a good set of earnings, all the controversy will be forgotten, or the buyers will come only at significantly lower price.",tata group stocks come under a cloud;good earnings key for any re-rating
0,"Oct 27, 2016, 06:37 PM IST",http://economictimes.indiatimes.com/markets/stocks/news/tata-group-stocks-come-under-a-cloudgood-earnings-key-for-any-re-rating/articleshow/55096002.cms,"if the group companies report a good set of earnings, all the controversy will be forgotten, or the buyers will come only at significantly lower price.",tata group stocks come under a cloud;good earnings key for any re-rating
0,"Oct 27, 2016, 06:24 PM IST",http://economictimes.indiatimes.com/markets/stocks/news/tata-group-cos-lose-over-rs-26000-cr-in-mcap-in-3-days/articleshow/55095780.cms,"tata motors scrip fell by 1.44 per cent, tata power slipped 1.36 per cent and tata steel went down by 0.44 per cent on thursday.","tata group cos lose over rs 26,000 cr in mcap in 3 days"
