,date,href,intro,title
0,"Oct 14, 2016, 01:02 PM IST",http://economictimes.indiatimes.com/markets/stocks/news/european-shares-rise-lifted-by-miners-and-telecom-stocks/articleshow/54847927.cms,"the pan-european stoxx 600 index rose 0.8 per cent, although the index remains down by around 8 per cent since the start of 2016.",european shares lifted by stronger mining and telecom stocks
0,"Oct 15, 2016, 09:58 AM IST",http://economictimes.indiatimes.com/markets/stocks/news/icici-bank-rejigs-top-deck-anup-bagchi-to-take-over-as-retail-chief/articleshow/54863043.cms,"bagchi who would succeed sabharwal joined icici in 1992 and has held key positions across retail, corporate, investment banking and treasury.","icici bank rejigs top deck, anup bagchi to take over as retail chief"
0,"Oct 15, 2016, 09:58 AM IST",http://economictimes.indiatimes.com/markets/stocks/news/icici-bank-rejigs-top-deck-anup-bagchi-to-take-over-as-retail-chief/articleshow/54863043.cms,"bagchi who would succeed sabharwal joined icici in 1992 and has held key positions across retail, corporate, investment banking and treasury.","icici bank rejigs top deck, anup bagchi to take over as retail chief"
0,"Oct 15, 2016, 07:11 AM IST",http://economictimes.indiatimes.com/markets/stocks/news/infosys-sets-a-quicker-pace-than-tcs-investors-may-find-it-attractive/articleshow/54859591.cms,"lower guidance notwithstanding, long-term investors may find
the it bellwether attractive on lower valuation, efficiency","infosys sets a quicker pace than tcs, investors may find it attractive"
0,"Oct 15, 2016, 07:11 AM IST",http://economictimes.indiatimes.com/markets/stocks/news/infosys-sets-a-quicker-pace-than-tcs-investors-may-find-it-attractive/articleshow/54859591.cms,"lower guidance notwithstanding, long-term investors may find
the it bellwether attractive on lower valuation, efficiency","infosys sets a quicker pace than tcs, investors may find it attractive"
0,"Oct 14, 2016, 12:55 PM IST",http://economictimes.indiatimes.com/markets/stocks/news/top-11-takeaways-from-infosys-q2-result-for-investors/articleshow/54845228.cms,"the company said its net sales stood at rs 17,310 crore for the quarter ended september 30 compared to rs 16,782 crore reported in the june quarter.",top 11 takeaways from infosys q2 result for investors
0,"Oct 14, 2016, 12:47 PM IST",http://economictimes.indiatimes.com/markets/stocks/news/top-ten-intraday-trading-ideas-for-afternoon-trade-for-friday-14-october-2016/articleshow/54847639.cms,etmarkets.com collated list of trading ideas from various experts and here's what they had recommended.,"top ten intraday trading ideas for afternoon trade for friday, 14 october 2016"
0,"Oct 14, 2016, 12:47 PM IST",http://economictimes.indiatimes.com/markets/stocks/news/nses-virtual-monopoly-winner-takes-it-all-in-the-biggest-index-options-market/articleshow/54847626.cms,"the nses position is so dominant that there is a de facto entry barrier for new exchanges, manoj nagpal, ceo at mumbai-based outlook asia capital pvt., said.",nse's virtual monopoly: winner takes it all in the biggest index options market
0,"Oct 17, 2016, 07:46 AM IST",http://economictimes.indiatimes.com/markets/stocks/news/fifteen-stocks-in-focus-on-monday-17-october-2016/articleshow/54889158.cms,the indian market is expected to open lower. here is a list of top fifteen stocks that are likely to be in focus today.,"fifteen stocks in focus on monday, 17 october 2016"
0,"Oct 17, 2016, 07:44 AM IST",http://economictimes.indiatimes.com/markets/stocks/news/technical-outlook-nifty-may-revisit-8500-level-traders-should-stay-light-for-now/articleshow/54889146.cms,"the negative sequence of lower tops and bottoms is still intact. the larger timeframe, like weekly chart, is indicating weak strength on upside bounce back.","technical outlook: nifty may revisit 8,500 level, traders should stay light for now"
0,"Oct 16, 2016, 12:40 PM IST",http://economictimes.indiatimes.com/markets/stocks/news/sp-dow-jones-readies-indices-for-bse-international-exchange-at-gift/articleshow/54878399.cms,"""new indices for gift are a work in progress and we are still in the process of research,"" s&p dow jones indices managing director (product management) alka banerjee told pti.",s&p dow jones readies indices for bse international exchange at gift
0,"Oct 16, 2016, 09:50 AM IST",http://economictimes.indiatimes.com/markets/stocks/news/the-week-that-was-after-fed-fears-china-shocks-over-to-earnings-jitters-this-week/articleshow/54876600.cms,"the bse benchmark sensex ended the week at 27,673, down 388 points, or 1.3 per cent. the nifty50 lost 114 points, or 1.3 per cent to settle at 8,583 on friday.","the week that was: after fed fears, china shocks; over to earnings jitters this week"
0,"Oct 17, 2016, 05:57 PM IST",http://economictimes.indiatimes.com/markets/stocks/news/mapping-the-market-icici-bank-flavour-of-the-day-auto-stocks-skid-on-fuel-price-hike/articleshow/54899837.cms,"the sensex closed at its lowest in over three months on monday, as investors braced themselves for a tepid earnings season, amid weakness in global markets.",mapping the market: icici bank flavour of the day; auto stocks skid on fuel price hike
0,"Oct 17, 2016, 05:50 PM IST",http://economictimes.indiatimes.com/markets/stocks/news/tech-view-nifty50-forms-large-bear-candle-avoid-long-positions-for-now/articleshow/54899202.cms,"a break below the psychological level of 8,500 can trigger further correction in the market. traders should avoid creating long positions as of now.",tech view: nifty50 forms 'large bear candle'; avoid long positions for now
0,"Oct 17, 2016, 02:39 PM IST",http://economictimes.indiatimes.com/markets/stocks/news/hong-kong-shares-drift-near-1-1/2-month-lows-ahead-of-china-economic-data/articleshow/54895709.cms,"the hang seng index fell 0.8 per cent, to 23,037.54, while the china enterprises index lost 0.6 per cent, to 9,541.08 points.",hong kong shares drift near 1-1/2-month lows ahead of china economic data
0,"Oct 18, 2016, 10:02 AM IST",http://economictimes.indiatimes.com/markets/stocks/news/idfc-classic-equity-fund-trading-play-lifts-show/articleshow/54910735.cms,"in the past three-year and five-year periods, the scheme has beaten its benchmark s&p bse 200 consistently. it lags behind its peers in the past three-year and five-year periods.",idfc classic equity fund: trading play lifts show
0,"Oct 18, 2016, 09:22 AM IST",http://economictimes.indiatimes.com/markets/stocks/news/whats-d-street-talking-about-before-opening-bell/articleshow/54908901.cms,"the nifty50 reclaimed its crucial level of 8,550 supported by gains in realty, metals, banks, autos, oil & gas, and power stocks.","sensex rallies 200 pts; nifty50 nears 8,600; icici bank surges 2%"
0,"Oct 18, 2016, 09:22 AM IST",http://economictimes.indiatimes.com/markets/stocks/news/whats-d-street-talking-about-before-opening-bell/articleshow/54908901.cms,"the nifty50 reclaimed its crucial level of 8,550 supported by gains in realty, metals, banks, autos, oil & gas, and power stocks.","sensex rallies 200 pts; nifty50 nears 8,600; icici bank surges 2%"
0,"Oct 17, 2016, 10:17 AM IST",http://economictimes.indiatimes.com/markets/stocks/news/icici-bank-shares-surge-5-on-essar-oil-mega-deal/articleshow/54891304.cms,"the 98 per cent stake will be worth rs 72,800 crore ($10.9 billion), including assumption of debt, making it the largest foreign direct investment in the segment.",icici bank shares surge 5% on essar oil mega deal
0,"Oct 17, 2016, 09:29 AM IST",http://economictimes.indiatimes.com/markets/stocks/news/market-cues-buzzing-at-breakfast-tables-this-morning/articleshow/54889164.cms,"the nifty50 was trading at 8,573 down 10 points or 0.12 per cent. it touched a high of 8,615.40 and a low of 8,570.65 in the first 30 minutes of trade.",sensex pares gains after 100-point rally; nifty50 turns choppy
0,"Oct 18, 2016, 01:27 PM IST",http://economictimes.indiatimes.com/markets/stocks/news/zensar-tech-shares-tank-6-on-disappointing-q2/articleshow/54914037.cms,"zensar technologies has reported a 25% decline in consolidated net profit at rs 68.8 crore for july-september quarter, impacted by currency movement.",zensar tech shares tank 6% on disappointing q2
0,"Oct 18, 2016, 12:42 PM IST",http://economictimes.indiatimes.com/markets/stocks/news/for-consistent-returns-look-at-auto-ancillary-stocks-8-grew-100-in-1-year/articleshow/54913311.cms,auto ancillary is one sector in which none of the stocks has given negative return in last one year. this shows the inherent strength of the business.,"for consistent returns, look at auto ancillary stocks; 8 grew 100% in 1 year"
0,"Oct 18, 2016, 07:13 PM IST",http://economictimes.indiatimes.com/markets/stocks/news/commodity-stocks-lift-shares-brexit-inflation-in-focus/articleshow/54920740.cms,"the pan-european stoxx 600 share index rose 1.4 per cent, led higher by a 2.9 per cent rise in the basic resources sub-index and a 2.2 per cent gain in banks.","commodity stocks lift shares; brexit, inflation in focus"
0,"Oct 18, 2016, 05:53 PM IST",http://economictimes.indiatimes.com/markets/stocks/news/mapping-the-market-banks-fuel-big-rally-logistics-up-ahead-of-gst-meet/articleshow/54918813.cms,"the sensex rose 520.91 points, breaching the crucial level of 28,000. the broader nifty50 of the nse cracked the 8,650 to settle at 8,677.90.",mapping the market: banks fuel big rally; logistics up ahead of gst meet
0,"Oct 18, 2016, 05:38 PM IST",http://economictimes.indiatimes.com/markets/stocks/news/tech-view-nifty50-forms-long-white-day-on-charts-traders-can-create-fresh-longs/articleshow/54918561.cms,a 'long white day' signifies that the market witnessed sustained buying interest from the bulls for the most part of the trading day which is a bullish sign.,tech view: nifty50 forms 'long white day' on charts; traders can create fresh longs
0,"Oct 18, 2016, 08:19 AM IST",http://economictimes.indiatimes.com/markets/stocks/news/axis-bank-cuts-its-benchmark-mclr-by-five-bps/articleshow/54909229.cms,axis rate move comes just a few days after the rbi reduced its benchmark repo rate by 25 basis points to 6.25%.,axis bank cuts its benchmark mclr by five bps
0,"Oct 18, 2016, 11:03 AM IST",http://economictimes.indiatimes.com/markets/stocks/news/top-ten-intraday-trading-ideas-for-afternoon-trade-for-tuesday-18-october-2016/articleshow/54911631.cms,etmarkets.com collated list of trading ideas from various experts and here's what they had recommended.,"top ten intraday trading ideas for afternoon trade for tuesday, 18 october 2016"
0,"Oct 19, 2016, 09:30 AM IST",http://economictimes.indiatimes.com/markets/stocks/news/market-cues-buzzing-at-breakfast-tables-this-morning/articleshow/54929192.cms,"the 30-share index was trading 10 points higher or 0.04 per cent at 28,061.05 it touched a high of 28,131.07 and a low of 28,029.14 in morning trade.","sensex pares gains after firm start; nifty50 holds 8,650 level"
0,"Oct 19, 2016, 08:58 AM IST",http://economictimes.indiatimes.com/markets/stocks/news/housing-finance-companies-rally-on-strong-dhfl-earnings/articleshow/54930369.cms,"analysts said smaller companies such as repco, dewan housing, canfin homes and gruh finance would fetch better returns than their larger peers like hdfc and lic housing.",housing finance companies rally on strong dhfl earnings
0,"Oct 19, 2016, 08:37 AM IST",http://economictimes.indiatimes.com/markets/stocks/news/hsbc-maintains-reduce-on-ultratech-sees-39-per-cent-downside/articleshow/54929789.cms,"the target price implies a downside of 39.2% from current levels. on tuesday, the stock closed at rs 4,015.25 on the bse, up 0.16% from the previous close.","hsbc maintains reduce rating on ultratech shares, sees 39% downside"
0,"Oct 19, 2016, 01:01 PM IST",http://economictimes.indiatimes.com/markets/stocks/news/bhel-icici-aurobindo-among-top-five-stocks-global-brokerages-are-bullish-on/articleshow/54934265.cms,"the domestic equity market is likely to remain volatile weighed down by global cues, but most market analysts say there is tremendous potential for long-term investors.","bhel, icici bank, aurobindo pharma among top five stocks global brokerages are bullish on"
0,"Oct 18, 2016, 04:16 PM IST",http://economictimes.indiatimes.com/markets/stocks/news/sensex-soars-521-pts-nifty-reclaims-8650-bank-stocks-rally-adani-ports-climbs-6-ril-2/articleshow/54916921.cms,"a slippage in the us dollar
from its seven-month high helped commodities notch up solid gains. besides, a sharp
rise in banking stocks also added to the rally.","sensex soars 521 pts; nifty reclaims 8,650; bank stocks rally; adani ports climbs 6%, ril 2%"
0,"Oct 18, 2016, 04:16 PM IST",http://economictimes.indiatimes.com/markets/stocks/news/sensex-soars-521-pts-nifty-reclaims-8650-bank-stocks-rally-adani-ports-climbs-6-ril-2/articleshow/54916921.cms,"a slippage in the us dollar
from its seven-month high helped commodities notch up solid gains. besides, a sharp
rise in banking stocks also added to the rally.","sensex soars 521 pts; nifty reclaims 8,650; bank stocks rally; adani ports climbs 6%, ril 2%"
0,"Oct 19, 2016, 08:13 AM IST",http://economictimes.indiatimes.com/markets/stocks/news/rbi-to-keep-a-close-watch-on-rupee-as-fed-readies-to-tighten/articleshow/54929471.cms,"rbi wants to boost its monitoring mechanism on currency derivatives on exchanges, said one of the two people in the know.",rbi to keep a close watch on rupee as fed readies to tighten
0,"Oct 19, 2016, 08:13 AM IST",http://economictimes.indiatimes.com/markets/stocks/news/rbi-to-keep-a-close-watch-on-rupee-as-fed-readies-to-tighten/articleshow/54929471.cms,"rbi wants to boost its monitoring mechanism on currency derivatives on exchanges, said one of the two people in the know.",rbi to keep a close watch on rupee as fed readies to tighten
0,"Oct 19, 2016, 11:36 AM IST",http://economictimes.indiatimes.com/markets/stocks/news/top-ten-intraday-trading-ideas-for-afternoon-trade-for-wednesday-19-october-2016/articleshow/54932826.cms,axis bank is a buy call with a target of rs 560 and a stop loss of rs 513 whereas oil india is a sell call with a target of rs 405 and a stop loss of rs 422.,"top ten intraday trading ideas for afternoon trade for wednesday, 19 october 2016"
0,"Oct 20, 2016, 09:58 AM IST",http://economictimes.indiatimes.com/markets/stocks/news/banking-data-breach-icici-bank-sbi-yes-bank-hdfc-shares-shrug-off-worries-to-rally/articleshow/54950496.cms,top banks in the country are either replacing or asking users to change security codes in what is emerging as one of the biggest breaches of financial data.,"banking data breach: icici bank, sbi, yes bank shares shrug off worries to rally"
0,"Oct 20, 2016, 09:58 AM IST",http://economictimes.indiatimes.com/markets/stocks/news/banking-data-breach-icici-bank-sbi-yes-bank-hdfc-shares-shrug-off-worries-to-rally/articleshow/54950496.cms,top banks in the country are either replacing or asking users to change security codes in what is emerging as one of the biggest breaches of financial data.,"banking data breach: icici bank, sbi, yes bank shares shrug off worries to rally"
0,"Oct 20, 2016, 09:58 AM IST",http://economictimes.indiatimes.com/markets/stocks/news/banking-data-breach-icici-bank-sbi-yes-bank-hdfc-shares-shrug-off-worries-to-rally/articleshow/54950496.cms,top banks in the country are either replacing or asking users to change security codes in what is emerging as one of the biggest breaches of financial data.,"banking data breach: icici bank, sbi, yes bank shares shrug off worries to rally"
0,"Oct 20, 2016, 09:58 AM IST",http://economictimes.indiatimes.com/markets/stocks/news/banking-data-breach-icici-bank-sbi-yes-bank-hdfc-shares-shrug-off-worries-to-rally/articleshow/54950496.cms,top banks in the country are either replacing or asking users to change security codes in what is emerging as one of the biggest breaches of financial data.,"banking data breach: icici bank, sbi, yes bank shares shrug off worries to rally"
0,"Oct 20, 2016, 09:56 AM IST",http://economictimes.indiatimes.com/markets/stocks/news/will-it-be-another-1billion-profit-quarter-for-ril-five-things-to-watch-out-for-in-q2/articleshow/54950416.cms,"the company is expected to report a marginal rise in net profit for the quarter ended september 30, but may report a drop in net sales, according to an etnow poll.",will it be another $1billion profit quarter for ril? five things to watch out for in q2
0,"Oct 20, 2016, 09:42 AM IST",http://economictimes.indiatimes.com/markets/stocks/news/five-cues-from-fo-mart-fresh-put-writing-at-8600-to-support-nifty50/articleshow/54950144.cms,"put unwinding or closing of existing positions was seen at strike prices 8,300 (1.9l contracts shed), 8400 (1.8l contracts shed) and 8500 (0.47l contracts shed).","five cues from f&o mart: fresh put writing at 8,600 to support nifty50"
0,"Oct 20, 2016, 04:12 PM IST",http://economictimes.indiatimes.com/markets/stocks/news/bank-stocks-lift-sensex-145-pts-nifty50-tops-8690/articleshow/54957495.cms,"in fact, financial stocks were main drivers of the market. shares of reliance industries closed 0.15 per cent higher ahead of september quarter earnings.","bank stocks lift sensex 145 points; nifty50 tops 8,690"
0,"Oct 21, 2016, 08:59 AM IST",http://economictimes.indiatimes.com/markets/stocks/news/tata-global-beverages-smells-good-but-cant-filter-all-risks/articleshow/54969697.cms,an improving operating margin profile since the past couple of quarters has been fuelling expectations of a smart recovery in tgb's performance in the quarters ahead.,"tata global beverages smells good, but can't filter all risks"
0,"Oct 21, 2016, 08:13 AM IST",http://economictimes.indiatimes.com/markets/stocks/news/earnings-review-no-slip-ups-this-quarter-yes-bank-to-set-aside-less-money/articleshow/54969068.cms,"our asset quality is the best in class. gross additions to npas were only rs 72 crore and there have been no additions to restructured loans,"" rana kapoor said.","earnings review: no slip ups this quarter, yes bank to set aside less money"
0,"Oct 21, 2016, 08:09 AM IST",http://economictimes.indiatimes.com/markets/stocks/news/fifteen-stocks-in-focus-on-friday-21-october-2016/articleshow/54969007.cms,the indian market is expected to open flat. here is a list of top fifteen stocks that are likely to be in focus today.,"fifteen stocks in focus on friday, 21 october 2016"
0,"Oct 21, 2016, 07:58 AM IST",http://economictimes.indiatimes.com/markets/stocks/news/other-news-priced-in-jio-can-set-the-ril-counter-ringing/articleshow/54968862.cms,the combination of refinery and petrochemicals as its core operation helped the company to offset cyclical correction and maintain consistency in earnings growth.,"other news priced in, jio can set the ril counter ringing"
0,"Oct 20, 2016, 09:25 AM IST",http://economictimes.indiatimes.com/markets/stocks/news/market-cues-buzzing-at-breakfast-tables-this-morning/articleshow/54948689.cms,"the nifty50 is trading near its crucial resistance level of 8,700 supported by gains in realty, power, oil & gas, banks, capital goods, and auto stocks.","sensex rallies 200 points; nifty50 reclaims 8,700 level"
0,"Oct 21, 2016, 10:47 AM IST",http://economictimes.indiatimes.com/markets/stocks/news/dear-mukesh-ambani-here-is-why-you-must-not-stop-spending-now/articleshow/54971078.cms,"reliance industries announced operating profit before exceptional items of rs 107.95 billion ($1.62 billion), a 36% jump from the year-earlier quarter.","dear mukesh ambani, here is why you must not stop spending now"
0,"Oct 20, 2016, 12:55 PM IST",http://economictimes.indiatimes.com/markets/stocks/news/australia-shares-edge-up-on-clinton-lead-in-presidential-debate-nz-flat/articleshow/54954189.cms,"according to a cnn snap poll, 52 per cent thought clinton won the debate while 39 per cent said trump was the victor.",australia shares edge up on clinton lead in presidential debate; nz flat
0,"Oct 21, 2016, 02:40 PM IST",http://economictimes.indiatimes.com/markets/stocks/news/whats-next-for-asias-best-performing-stock-market/articleshow/54972974.cms,"pakistan has plowed an independent trajectory this year, outperforming both its fellow frontier markets and members of em grouping.",which is asia's best-performing stock market? guess what... it's pakistan
0,"Oct 24, 2016, 07:54 AM IST",http://economictimes.indiatimes.com/markets/stocks/news/technical-outlook-for-diwali-week-8830-to-be-key-resistance-for-nifty/articleshow/55022825.cms,"nifty 8,830 will be a strong resistance. if that is crossed then 9,000-9,200 levels can be opened up, but if it trades below 8500, some correction can be seen.","technical outlook for diwali week: 8,830 to be key resistance for nifty"
0,"Oct 21, 2016, 10:35 AM IST",http://economictimes.indiatimes.com/markets/stocks/news/d-street-gives-thumbs-down-to-ril-q2-results-brokerages-see-up-to-24-upside/articleshow/54971144.cms,"however, global brokerages such as clsa, bofa-ml and goldman sachs see up to 24 per cent upside in the stock over the next one year.",dalal street gives thumbs down to reliance industries q2 results; brokerages see up to 24% upside
0,"Oct 21, 2016, 10:35 AM IST",http://economictimes.indiatimes.com/markets/stocks/news/d-street-gives-thumbs-down-to-ril-q2-results-brokerages-see-up-to-24-upside/articleshow/54971144.cms,"however, global brokerages such as clsa, bofa-ml and goldman sachs see up to 24 per cent upside in the stock over the next one year.",dalal street gives thumbs down to reliance industries q2 results; brokerages see up to 24% upside
0,"Oct 24, 2016, 11:22 AM IST",http://economictimes.indiatimes.com/markets/stocks/news/top-ten-intraday-trading-ideas-for-afternoon-trade-for-monday-24-october-2016/articleshow/55025801.cms,etmarkets.com collated list of trading ideas from various experts and here's what they had recommended.,"top ten intraday trading ideas for afternoon trade for monday, 24 october 2016"
0,"Oct 24, 2016, 10:57 AM IST",http://economictimes.indiatimes.com/markets/stocks/news/bharti-idea-cellular-tank-as-trai-recommends-rs-3050-crore-fine/articleshow/55025445.cms,"following the development, shares of bharti airtel fell 1.77 per cent to hit a low of rs 303 on bse. idea cellular dropped 2.5 per cent to a low of rs 78.","idea, airtel down up to 4% as trai asks dot to impose fine"
0,"Oct 24, 2016, 10:44 AM IST",http://economictimes.indiatimes.com/markets/stocks/news/5-cues-from-fo-mart-market-base-shifts-higher-towards-the-8600-level/articleshow/55025215.cms,"total put open interest of 55.05 lakh contracts stood at strike price 8,600, which will act as a crucial base for the market in the october series.","5 cues from f&o mart: market base shifts higher towards the 8,600 level"
0,"Oct 22, 2016, 11:33 AM IST",http://economictimes.indiatimes.com/markets/stocks/news/brokerages-remain-positive-on-yes-bank-raise-target-price/articleshow/54993469.cms,"brokerages raised target prices on yes bank by 3-11%, with axis capital increasing it the most.","brokerages remain positive on yes bank, raise target price"
0,"Oct 22, 2016, 11:17 AM IST",http://economictimes.indiatimes.com/markets/stocks/news/now-mirae-curbs-investments-into-emerging-bluechip-fund/articleshow/54993072.cms,unabated flows into mutual fund schemes and rich stock valuations have made it tedious for fund managers to deploy money into midand small-cap shares.,"now, mirae curbs investments into emerging bluechip fund"
0,"Oct 22, 2016, 10:41 AM IST",http://economictimes.indiatimes.com/markets/stocks/news/early-diwali-on-d-street-will-these-fireworks-lift-nifty50-to-new-highs/articleshow/54992459.cms,"nifty correction over the past 5 weeks seems to be healthy, which has now set the base for the market to touch new high before the end of this calendar year.",early diwali on d-street: will these fireworks lift nifty50 to new highs?
0,"Oct 22, 2016, 10:23 AM IST",http://economictimes.indiatimes.com/markets/stocks/news/india-looks-bright-among-em-peers-nifty-to-hit-record-high-by-next-diwali/articleshow/54992037.cms,green shoots visible in banking sector. 2 factors that can propel market to record highs are earnings growth and flow of domestic savings into financial assets.,india looks bright among em peers; nifty to hit record high by next diwali
0,"Oct 22, 2016, 09:59 AM IST",http://economictimes.indiatimes.com/markets/stocks/news/ritesh-jains-what-i-read-this-week-why-a-15-yr-old-hedge-fund-shut-shop-apparel-to-indias-rescue-on-jobs-front/articleshow/54992153.cms,"there is some interesting stuff about how indias economic growth has coincided with a growing employment crisis, says ritesh jain of tata amc.",ritesh jain's what i read this week: why a 15-yr-old hedge fund shut shop & apparel to indias rescue on jobs front
0,"Oct 21, 2016, 06:46 PM IST",http://economictimes.indiatimes.com/markets/stocks/news/sbi-arm-sbbj-logs-rs-210-cr-loss-in-q2/articleshow/54978877.cms,"total income of the bank fell slightly to rs 2,614.21 crore from rs 2620.34 crore earned in the same quarter of previous fiscal.",sbi arm sbbj logs rs 210 cr loss in q2
0,"Oct 21, 2016, 01:53 PM IST",http://economictimes.indiatimes.com/markets/stocks/news/china-stocks-edge-up-lifted-by-infrastructure-plays/articleshow/54974220.cms,"the blue-chip csi300 index rose 0.3 per cent, to 3,327.80 points, while the shanghai composite index gained 0.2 per cent, to 3,091.29 points.","china stocks edge up, lifted by infrastructure plays"
0,"Oct 23, 2016, 11:44 AM IST",http://economictimes.indiatimes.com/markets/stocks/news/sebi-relaxes-restrictions-on-41-companies/articleshow/55009714.cms,"the entitie have now been given certain relaxations, including permission to deal in government securities and invest in exchange-traded funds.",sebi relaxes restrictions on 41 companies
